name,name_abbreviation,decision_date,docket_number,first_page,last_page,citations,court,jurisdiction,casebody
MORRIS v. DISTRICT OF COLUMBIA,Morris v. District of Columbia,1943-05-11,No. 67,652,654,"[{'type': 'official', 'cite': '31 A.2d 652'}]","{'name_abbreviation': 'D.C.', 'id': 21806, 'name': 'District of Columbia Municipal Court of Appeals'}","{'id': 56, 'name_long': 'District of Columbia', 'name': 'D.C.'}","{'judges': ['Before RICHARDSON, Chief Judge, and CAYTON and HOOD, Associate Judges.'], 'parties': ['MORRIS v. DISTRICT OF COLUMBIA.'], 'opinions': [{'text': 'HOOD, Associate Judge.\nThis is an appeal from a conviction of the offense commonly known as disorderly conduct. The statute, in part, makes it unlawful for any person to use profane language or indecent or obscene words, or engage in any disorderly conduct in any street, avenue, or other public place.\nThe evidence was to the effect that the complaining witness and her escort, a member of the armed services, engaged a taxicab operated by the appellant to take them to the Union Station, that at the station the witness’ escort left the cab and she instructed appellant to drive her to her home several miles away in the Northwest section of the District; that on the way appellant made certain suggestions and remarks to the witness of an indecent and obscene nature, and repeated the suggestions both en route and upon reaching their destination. This occurred at about 1:30 o’clock in the morning.\nAppellant admitted he was the driver of the taxicab but denied making the remarks. The trial was without a jury and the court found appellant guilty.\nAppellant’s chief contention is that the taxicab was a private place at the time of the remarks, that an occupied cab at 1:30 A. M. cannot be considered a public place within the meaning of the statute, and, therefore, no offense was committed. Undoubtedly, the statute is directed at conduct in public places. Such statutes commonly prohibit the use in public places of words which are lewd, obscene or profane, and insulting or “fighting” words, which when spoken face to face are likely to incite an immediate breach of the peace.\nHad appellant made the remarks to the complaining witness while she was standing in the street and preparing to enter the cab, there would have been a clear violation of the statute. Does the fact he made the remarks after she was in the cab make a difference? We think not.\nA taxicab is a common carrier and public utility, deriving its income from the use of public streets and avenues, subject to the call of any member of the public, and while often occupied by only one passenger or one group, it is common knowledge that today such vehicles may and frequently do carry a number of wholly unrelated and unacquainted persons. The fact that the complaining witness was the only passenger at the time is no defense. The presence of others than the offender and the person addressed is not necessary to complete the offense.\nWe are satisfied that a public vehicle plying its business on a public street is a public place within the meaning of the statute.\nAppellant also contends that his remarks did not constitute “profane language, indecent and obscene words.” The record shows no use of profanity by appellant, but, without detailing appellant’s remarks, we think there was ample justification for the trial judge finding such remarks indecent and obscene. The words “indecent” and “obscene” are not susceptible of exact definition, and in determining whether the remarks of appellant were within the prohibition of the statute, the trial judge was entitled to consider all the surrounding circumstances, the time of the occurrence and the manner in which it occurred, the repetition of those remarks, as well as the lack of previous acquaintance.\nFinally, appellant complains the information also charged that “he attempted to engage in conversation a certain female who was then and there unknown to him,” and that this charges no violation of the statute. It is not necessary for us to pass upon this question, since the information contains other specifications clearly within the statute.\nAffirmed.\nCode 1940, 22—1107.\nSee Chaplinsky v. New Hampshire, 315 U.S. 568, 62 S.Ct. 766, 86 L.Ed. 1031.\nTerminal Taxicab Co. v. Kutz, 241 U.S. 252, 36 S.Ct. 583, 60 L.Ed. 984, Ann.Cas.1916D, 765.\nJackie Cab Co. v. Chicago Park District, 366 Ill. 474, 9 N.E.2d 213.\nAnderson v. Yellow Cab Co., 179 Wis. 300, 191 N.W. 748, 31 A.L.R. 1197.\nState v. McConnell, 70 N.H. 294, 47 A. 267.\nParmelee v. United States, 72 App.D. C. 203, 113 F.2d 729.\nPeople v. Yergan, 164 Misc. 83, 299 N.Y.S. 248.', 'type': 'majority', 'author': 'HOOD, Associate Judge.'}], 'attorneys': ['Harry Friedman, of Washington, D. C., for appellant.', 'Vernon E. West, Principal Asst. Corp. Counsel, of Washington, D. C. (Richmond B. Keech, Corp. Counsel, and E. A. Beard, Asst. Corp. Counsel, both of Washington, D. C., on the brief), for appellee.'], 'corrections': '', 'head_matter': 'MORRIS v. DISTRICT OF COLUMBIA.\nNo. 67.\nMunicipal Court of Appeals for the District of Columbia.\nMay 11, 1943.\nRehearing Denied May 25, 1943.\nHarry Friedman, of Washington, D. C., for appellant.\nVernon E. West, Principal Asst. Corp. Counsel, of Washington, D. C. (Richmond B. Keech, Corp. Counsel, and E. A. Beard, Asst. Corp. Counsel, both of Washington, D. C., on the brief), for appellee.\nBefore RICHARDSON, Chief Judge, and CAYTON and HOOD, Associate Judges.'}"
"HESLOP v. ROBERT A. GRAHAME, Inc.","Heslop v. Robert A. Grahame, Inc.",1942-11-23,No. 11,856,857,"[{'type': 'official', 'cite': '31 A.2d 856'}]","{'name_abbreviation': 'D.C.', 'id': 21806, 'name': 'District of Columbia Municipal Court of Appeals'}","{'id': 56, 'name_long': 'District of Columbia', 'name': 'D.C.'}","{'judges': ['Before RICHARDSON, Chief Judge, and CAYTON and HOOD, Associate Judges.'], 'parties': ['HESLOP v. ROBERT A. GRAHAME, Inc.'], 'opinions': [{'text': ""HOOD, Associate Judge.\nAppellant brought suit below on an open account. Trial was had before the court without a jury, resulting in a finding and judgment for the defendant.\nThe record on appeal contains two statements of proceedings and evidence, one being entitled “Plaintiff’s Statement of Proceedings and Evidence,” and the other “Defendant’s Statement of Proceedings and Evidence.” The two statements are in conflict as to the proceedings had and evidence received at the trial, yet both were approved by the trial judge. This situation is accounted for by appellant in his brief with the statement that “the trial judge did not sufficiently recall the evidence at that date to pass upon the contentions of opposing counsel, so by agreement of counsel he approved and sent up contentions of both sides which are in conflict.”\nRule 25 of this court requires all statements of proceedings and evidence to be submitted to and approved by the trial court.\nBy Rule 27(g), (i) and (j) appellant'is required to file and submit to the trial judge a statement of proceedings and evidence; appellee is permitted to file objections to that statement; and the trial judge is required to settle and approve the statement.\nA statement of proceedings and evidence properly settled and approved by the trial judge must be accepted by this court as correct (Graziani v. Arundell et al., 55 App.D.C. 21, 299 F. 886; Klingstein v. Thomas Circle Cafe, 68 App.D.C. 5, 92 F.2d 554), and this court can consider only what the record discloses. Davidge v. Simmons, 49 App.D.C. 398, 266 F. 1018; Harrah et al. v. Morgenthau, 67 App.D.C. 119, 89 F.2d 863. See, also, Marvin’s Credit, Inc. v. Hall, App.D.C., 129 F.2d 57.\nIn the instant case the trial judge did not settle the statement, but instead approved two conflicting statements. We have neither power nor means of determining what actually occurred at the trial; that is to be settled and determined by the trial court.\nArgument at the hearing was limited to the question of our right to hear the appeal in this state of the record. Consideration of the question and examination of the record convinces us it would be both improper and useless to attempt to pass upon the merits without a record which we can accept as conclusive.\nThis case is remanded to the trial court to settle the differences existing as to what occurred at the trial, and to approve and send to this court one correct statement of proceedings and evidence. If it is impossible for the trial judge to settle the statement of proceedings and evidence, he should set aside the judgment and order a new trial (Hume v. Bowie, Adm’r, 148 U.S. 245, 13 S.Ct. 582, 37 L.Ed. 438; Malony v. Adsit, 175 U.S. 281, 20 S.Ct. 115, 44 L.Ed. 163; Evans v. Humphreys, 9 App.D.C. 392), but since this would deprive appel-lee of the benefit of a judgment already obtained, it is hoped that the trial judge will again make an earnest effort to determine what occurred at the trial and to embody such determination in a single ' approved statement.\nRemanded for further proceedings in accordance with this opinion."", 'type': 'majority', 'author': 'HOOD, Associate Judge.'}], 'attorneys': ['Vivian O. Hill, of Washington, D. C., for appellant.', 'Douglas A. Clark, of Washington, D. Cv for appellee.'], 'corrections': '', 'head_matter': 'HESLOP v. ROBERT A. GRAHAME, Inc.\nNo. 11.\nMunicipal Court of Appeals for the District of Columbia.\nNov. 23, 1942.\nVivian O. Hill, of Washington, D. C., for appellant.\nDouglas A. Clark, of Washington, D. Cv for appellee.\nBefore RICHARDSON, Chief Judge, and CAYTON and HOOD, Associate Judges.'}"
WASHINGTON NAT. INS. CO. v. STANTON et al.,Washington Nat. Ins. v. Stanton,1942-11-23,No. 9,680,683,"[{'type': 'official', 'cite': '31 A.2d 680'}]","{'name_abbreviation': 'D.C.', 'id': 21806, 'name': 'District of Columbia Municipal Court of Appeals'}","{'id': 56, 'name_long': 'District of Columbia', 'name': 'D.C.'}","{'judges': ['Before RICHARDSON, Chief Judge, and CAYTON and HOOD, Associate Judges.'], 'parties': ['WASHINGTON NAT. INS. CO. v. STANTON et al.'], 'opinions': [{'text': 'CAYTON, Associate Judge.\nThis is an appeal from the Municipal Court for the District of Columbia, from a judgment entered on the verdict of a jury in favor of the plaintiffs who sued as beneficiaries of a policy of industrial life insurance.\nThe single assignment of error relied upon relates to the refusal of the trial judge to direct a verdict in favor of the defendant upon the whole evidence.\nThe policy was issued on October 3, 1938, and contained a provision that if the insured had within two years before its date been attended by a physician for any serious disease or complaint, it should be voidable and the liability of the company limited to the return of premiums paid.\nThe insured died on April 18, 1940, less than six months before the policy would, by its terms, have become incontestable.\nThe claim of the beneficiaries for the face amount of the policy was rejected by the company on the ground that the deceased had within two years before the date of the policy suffered from a serious disease or complaint, namely, arthritis. The company tendered the return of $49.20, being the total amount of premiums paid in. This was rejected and suit commenced on the policy. At the trial plaintiffs proved the policy and the death of the insured, and rested.\nThe substance of defendant’s testimony was that the insured had for some time suffered from a severe case of arthritis which involved her left shoulder joint, finger joints, and knee joints, with some involvement of her right elbow; and that she had been hospitalized on three different occasions for treatment of the ailment.\nA physician called by the defendant testified, in substance, that a patient with the symptoms and in the physical condition revealed by the history of the insured was in fact suffering from a serious disease; that it would prevent her from pursuing her normal everyday occupation and had, in fact, incapacitated this patient; that the various bone changes were permanent, although she might from time to time regain the use of the affected parts; that the ailment would tend to become progressively worse and she would finally become bedridden. His testimony was further that the patient would be bound to know she had a serious disease because of the excruciating pain she would suffer, the long periods of time spent in the hospital, and the incapacitating effect of the ailment.\nA sister of the insüred, called by defendant, testified that there were many times during the period between July, 1937, and April, 1938, when the deceased could not walk or use her arms, hands, or legs; that the insured told her that she had arthritis but that she did not consider her condition as serious; that later, during the period when the insured lived with her, she could do ordinary household tasks around the house; that they had discussed the situation many times and the insured never regarded her illness as serious; that insured had told her many times that the doctor had told her it was not serious, and that no one had ever died from it, and that it would leave her as quickly as it came upon her, and she felt that was going to happen.\nPlaintiff in rebuttal called the physician who attended the insured during 1937 and part of 1938, and during all of the time she was in the hospital. He testified that in the early summer of 1937 she was almost totally incapacitated by arthritis; that he had treated her with some success; and that he placed her in the hospital not because she was actually in need of hospitalization but because he was treating her with sulfa drugs and wanted to keep her under observation. He testified that the ailment was serious only in the sense that it temporarily restricted the motion of certain parts of the body; that it was an illness that would, and did, leave the patient as quickly as it had come upon her; that her condition would not be permanent, and that any incapacity would be of a temporary nature; that the arthritis from which she was suffering was not dangerous to life and that it would not, and did not, shorten her life; and that the patient had made a “perfectly marvelous” recovery after she left the hospital in April, 1938, and was able to do ordinary household tasks.\nBy way of further rebuttal a daughter of the insured testified that during the time her mother was in the hospital in April, 1938, she heard the doctor tell her mother that the illness would be only of a temporary nature and that it would leave her as quickly as it had come upon her.\nThe insured died at Georgetown Hospital on April 18, 1940, after an operation for fibroma of the cervix. The cause of death was hemorrhage at operation and postoperative shock. It is conceded that the operation and resulting death were in no manner attributable to the prior arthritic condition of the insured.\nUpon this showing the trial judge refused a peremptory instruction for the defendant, and refused to limit plaintiffs’ recovery to a refund of premiums. He submitted the case to the jury upon instructions to which no exception was taken, and concerning which there is no complaint here.\nThe question presented is whether upon the whole evidence there was a case to go to the jury.\nThe policy involved comes within the purview of Title 35, Section 1002, 1940 edition, District of Columbia Code. The effect of that section is to cast the burden of proof upon the insurer and to require that it establish that the ailment was serious and that the insured knew, or had reason to know, the facts on which the defense is based.\nIn our view there was a substantial conflict in the evidence upon both of these points. The two physicians who testified for the respective parties offered sharply contradictory views on the medical aspects of the case. Furthermore, the physician of the insured directly rebutted defendant’s contention that insured had either real or imputed knowledge of the alleged seriousness of her condition. Further substantial contradiction on this point came from the two lay witnesses.\nIt is established in this jurisdiction that in cases of this type, where there is no conflict in the evidence or no contradiction of a showing of the existence of a serious disease, the trial judge must take the case from the jury and rule as a matter of law in favor of the insurer. Pullen v. Sun Life Ins. Co. of America, 1941, 74 App.D.C. 197, 121 F.2d 110. It is, however, equally well established that where plaintiff creates a substantial issue of fact on the question of unsound health, it becomes a question for the jury and not for the court. Healy v. Metropolitan Life Ins. Co., 1911, 37 App.D.C. 240. See, also, Mays v. New Amsterdam Casualty Co., 1913, 40 App.D.C. 249, 46 L.R.A.,N.S., 1108, in which the Court said, “If there is room for doubt, the jury should determine the question.” This rule was reaffirmed on a second appeal of the same case, in New Amsterdam Casualty Co. v. Mays, 1915, 43 App.D.C. 84.\nIt should be noted that the three last named cases were decided prior to the enactment of the Code section cited above, and that the legal position of these plaintiffs is by that fact so much the stronger, becausé by legislative fiat the burden of proof is now placed squarely upon the defendant.\nAside from the statute, we regard the case as one which should have been submitted to the jury. As was said by the Supreme Court in Gunning v. Cooley, 1930, 281 U.S. 90, 94, 50 S.Ct. 231, 233, 74 L.Ed. 720: “Issues that depend on the credibility of witnesses, and the effect or weight of evidence, are to be decided by the jury. And in determining a motion of either party for a peremptory instruction, the court assumes that the evidence for the opposing party proves all that it reasonably may be found sufficient to establish, and that from such facts there should be drawn in favor of the latter all the inferences that fairly are deducible from them. [Citations] Where uncertainty as to the existence of negligence arises from a conflict in the testimony or because, the facts being undisputed, fair-minded men will honestly draw different conclusions from them, the question is not one of law but of fact to be settled by the jury. [Citation]”\nThe most recent expression on this subject was in the case of Jacob v. City of New York, 315 U.S. 752, 62 S.Ct. 854, 856, 86 L.Ed. 1166, decided March 30, 1942, where the Supreme Court said: “Without doubt the case is close and a jury might find either way. But that is no reason for a court to usurp the function of the jury.”\nIn appellant’s brief a number of cases are cited from other jurisdictions. They are not decisive of this issue because they either involve situations where there was no conflict in the evidence or no contradiction by medical witnesses of a showing of unsound health; or they are from jurisdictions where the burden of proof is upon the plaintiff to affirmatively establish sound health.\nIn our view of the case the action of the trial judge in submitting the disputed issues to the -jury was correct. The judgment should be affirmed.\n.We think it advisable to direct attention to a procedural aspect of this case. Appellant submitted a Statement of Proceedings and Evidence to the trial judge. Appellees filed objections thereto. Both the statement and the objections were approved by the trial judge and separately incorporated into the record. This makes for confusion and requires us to grope through two disconnected parts of the record to piece the evidence together and reconstruct the factual picture. It is not a compliance with our Rules. The proper procedure would be to have the Statement of Proceedings and Evidence reflect in one document a complete and continuous narrative statement of what happened at the trial.\nAffirmed.\n“If payment of such a policy shall be refused because of unsound health at or prior to the date of the policy, the good faith of both applicant and insured shall constitute a material element in determining the validity of the policy; and it shall not be held invalid because of unsound health unless the insurer shall prove that, at or before the date of issue of the policy, the insured or applicant had knowledge of, or reason to know, the facts •on which the defense is based, or shall prove that the insurance was procured by the insured or applicant in bad faith or with intent to defraud the company, any provision, agreement, condition, warranty, or clause contained in said policy * * * to the contrary notwithstanding. * * * ” (Enacted June 4, 1934.)\nRoush v. Metropolitan Life Insurance Co., 1935, 116 Pa.Super. 162, 176 A. 809; Greenbaum v. Columbian Nat. Life Insurance Co., 2 Cir., 62 F.2d 56; Palyo v. Western & Southern Life Insurance Co., 1934, 114 Pa.Super. 583, 174 A. 640; Butkevicus v. John Hancock Mutual Life Insurance Co., 1930, 228 App.Div. 501, 240 N.Y.S. 358; Rossetti v. Metropolitan Life Insurance Co., Co.Ct.1939, 10 N.Y.S.2d 437; Kennedy v. Prudential Insurance Co., 177 Ill.App. 50; Winn v. Provident Life & Trust Co., 99 App.Div. 103, 91 N.Y.S. 167; Life & Casualty Insurance Co. v. Runnion, 1935, 20 Tenn.App. 13, 94 S.W.2d 405; Equitable Life Assurance Society v. Keiper, 3 Cir., 165 F. 595; New York Life Insurance Co. v. Brandwene, 1934, 316 Pa. 218, 172 A. 669.', 'type': 'majority', 'author': 'CAYTON, Associate Judge.'}], 'attorneys': ['Arthur H. Clephane, of Washington, D. C. (Walter C. Clephane, J. Wilmer Lati-mer, and Gilbert L. Hall, all of Washington, D. C., on the brief), for appellant.', 'Daniel B. Maher, of Washington, D. C. (Dennis Collins, of Washington, D. C., on the brief), for appellees.'], 'corrections': '', 'head_matter': 'WASHINGTON NAT. INS. CO. v. STANTON et al.\nNo. 9.\nMunicipal Court of Appeals for the District of Columbia.\nNov. 23, 1942.\nArthur H. Clephane, of Washington, D. C. (Walter C. Clephane, J. Wilmer Lati-mer, and Gilbert L. Hall, all of Washington, D. C., on the brief), for appellant.\nDaniel B. Maher, of Washington, D. C. (Dennis Collins, of Washington, D. C., on the brief), for appellees.\nBefore RICHARDSON, Chief Judge, and CAYTON and HOOD, Associate Judges.'}"
