name,name_abbreviation,decision_date,docket_number,first_page,last_page,citations,court,jurisdiction,casebody
"MacDONALD, to Use of EMMCO INS. CO., Inc., v. CAPITAL TRANSIT CO.",MacDonald ex rel. Emmco Ins. Co. v. Capital Transit Co.,1943-05-11,No. 66,862,864,"[{'type': 'official', 'cite': '31 A.2d 862'}]","{'name_abbreviation': 'D.C.', 'id': 21806, 'name': 'District of Columbia Municipal Court of Appeals'}","{'id': 56, 'name_long': 'District of Columbia', 'name': 'D.C.'}","{'judges': ['Before RICHARDSON, Chief Judge, and CAYTON and HOOD, Associate Judges.'], 'parties': ['MacDONALD, to Use of EMMCO INS. CO., Inc., v. CAPITAL TRANSIT CO.'], 'opinions': [{'text': 'RICHARDSON, Chief Judge.\nSuit was brought by the owner of an automobile for damages caused to it by the alleged negligent operation of a street car of the- defendant Transit Company. The case was tried by the court without a jury. Judgment was for defendant upon a finding that the car colliding with plaintiff’s automobile was not negligently operated by defendant’s motorman. Plaintiff has appealed. As the question on this appeal is whether the trial court’s finding “is plainly wrong or without evidence to support it” a statement of the pertinent facts will be necessary.\nOn the morning of September 8, 1942, plaintiff was operating his automobile in an easterly direction on Rhode Island Avenue, N. E. Several blocks west of the underpass beneath the tracks of the Baltimore & Ohio Railroad, he had passed defendant’s street car and had then preceded it along that portion of the street occupied by the car tracks through and to a point 200 feet beyond the underpass.\nAs he emerged from the underpass, plaintiff observed an automobile on the car tracks approximately 200 feet ahead. This automobile driven by one Albright had come from the opposite direction; had made a left turn to cross the tracks, and had been unable to proceed further because of the line of traffic eastbound between the tracks and the curb. A westbound street car was then approaching that automobile, which clearing the westbound track, and unable to advance further, had come to a stop on the eastbound tracks.\nPlaintiff, who was travelling at a speed of 15 to 20 miles per hour as he came from the underpass and became aware of this situation, began to slow his automobile by applying its brakes, until he reached a point close to the obstructing automobile, where he stopped. The westbound street car passed at approximately that time. A moment later his automobile was struck from the rear by the street car which followed him. He did not know where this car was when he came to a stop.\nThe foregoing facts were undisputed. In all substantial details they were corroborated by disinterested witnesses to the collision.\nThe motorman, operating the street car involved, testified as a witness for defendant. He stated that he saw plaintiff’s automobile before entering the underpass, and “when he was coming out of the underpass he saw the MacDonald automobile with brake lights on and off and that he applied his brakes.” He was 30 to 40 feet behind it when it came to a stop. He threw on the emergency, but realized he could not stop in time to avoid a collision. The speed of his car was about 15 miles per hour, at which he could stop in 50 to 60 feet.\nThis covers the entire testimony of the operator of the street car. He does not state whether or not he observed the conditions before him which required plaintiff to stop. Although he saw plaintiff’s brake lights flashing when he emerged from the underpass, 200 feet from the point where the collision occurred, he offers no explanation of the fact that he was going at a speed of 15 miles per hour, 30 tó 40 feet behind plaintiff when the latter came to a full stop.\nDefendant also produced the operator of its car passing on the westbound track. He testified that his car “had passed the Albright automobile just as the MacDonald automobile was coming to a stop.” As the Albright automobile must have cleared the westbound tracks and stopped on the eastbound tracks before this car passed, it is clear that it was not suddenly projected in front of the on-coming automobile and street car, and did not create an emergency which would have made the collision unavoidable.\nA street car company has a preferential but not the exclusive right to use that portion of the streets occupied by its tracks. That area of the street is not withdrawn from the public use. Each must exercise its right with reasonable regard for the other.\nThe United States Court of Appeals for this district has declared that this exercise of reasonable care on the part of the company requires the car operator “to keep a diligent lookout ahead so that the car may be stopped in time, if possible, to avoid injury”; “to have his car under ready control so that it may be readily stopped when the danger is found to be imminent”. It has held that the duty to avoid a collision is not postponed until the car operator has actual knowledge of the peril ahead but arises when by the exercise of reasonable care he would have realized it.\nIn our opinion the operator of defendant’s car failed to observe or appreciate the very obvious situation before him and proceeded, closely following plaintiff’s automobile, at a speed and to a point where a collision was inevitable, and this notwithstanding the fact that as he emerged from the underpass he had been warned of danger by the application of plaintiff’s brakes.\nReversed and remanded for new trial.\nPublic Law 512 — 77th Congress, Act April 1, 1942, 56 Stat. 196, § 7.\nCapital Traction Co. v. Apple, 34 App.D.C. 559; Capital Traction Co. v. Divver, 33 App.D.C. 332.\nCapital Traction Co. v. Apple (cited in Note 2); Kelly Furniture Co. v. Washington Ry. & Elec. Co., 64 App.D.C. 215, 76 F.2d 985; Capital Traction Co. v. Crump, 35 App.D.C. 169.\nCases cited in Note 3.\nJackson v. Capital Transit Co., 69 App.D.C. 147, 99 F.2d 380; Washington-Virginia R. Co. v. Himelright, 42 App.D.C. 532; Washington Ry. & Elec. Co. v. Cullember, 39 App.D.C. 316.', 'type': 'majority', 'author': 'RICHARDSON, Chief Judge.'}], 'attorneys': ['Samuel Barker, of Washington, D. C. (William R. Lichtenberg, of Washington, D. G, on the brief), for appellant.', 'R. E. Lee Goff, of Washington, D.. C. (Bowen and Kelly, of Washington, D. C., on the brief), for appellee.'], 'corrections': '', 'head_matter': 'MacDONALD, to Use of EMMCO INS. CO., Inc., v. CAPITAL TRANSIT CO.\nNo. 66.\nMunicipal Court of Appeals for District of Columbia.\nMay 11, 1943.\nSamuel Barker, of Washington, D. C. (William R. Lichtenberg, of Washington, D. G, on the brief), for appellant.\nR. E. Lee Goff, of Washington, D.. C. (Bowen and Kelly, of Washington, D. C., on the brief), for appellee.\nBefore RICHARDSON, Chief Judge, and CAYTON and HOOD, Associate Judges.'}"
"SMITH & GOTTLIEB, Inc., v. CHEATHAM","Smith & Gottlieb, Inc. v. Cheatham",1942-12-21,No. 6,676,678,"[{'type': 'official', 'cite': '31 A.2d 676'}]","{'name_abbreviation': 'D.C.', 'id': 21806, 'name': 'District of Columbia Municipal Court of Appeals'}","{'id': 56, 'name_long': 'District of Columbia', 'name': 'D.C.'}","{'judges': ['Before RICHARDSON, Chief Judge, HOOD, Associate Judge, and McMAHON, Judge of Municipal Court for District of Columbia.'], 'parties': ['SMITH & GOTTLIEB, Inc., v. CHEATHAM.'], 'opinions': [{'text': ""RICHARDSON, Chief Judge.\nOn June 28, Í939 appellee purchased from appellant certain premises in Takoma Park, Maryland. A written contract of sale of that date provided in part: “that assessments for improvements completed prior to the date hereof, whether assessment thereon has been levied or not, shall be paid by the seller or allowance made therefore at the time of transfer.”\nIt is conceded that prior thereto improvements consisting of water main and sewer, had been completed by the Washington Suburban Sanitary Commission. Under Maryland law the cost of this improvement is imposed upon the property as a benefit charge and constitutes a lien thereon. Baker v. Smith & Gottlieb, Inc., App.D.C., 132 F.2d 18 decided November 30, 1942. It could have been discharged in the present instance (at the time of the transfer) by a payment of $421.44; otherwise it must be paid in annual installments of $17.68 over a period-of fifty years, the increase in amount representing interest cumulated and prorated.\nWhen the transaction of sale was closed and the property transferred to the purchaser the seller did not pay or make allowance for this assessment. Thereafter he disclaimed liability. Appellee then instituted an action, No. 397,249, in the Municipal Court for the District of Columbia, claiming the sum of $421.44 for breach of the contract.\nThat action was tried by the court without a jury. It resulted in a general finding and judgment for the plaintiff on September 19, 1941 for the sum of $17.36.\nAppellee filed a motion for new trial, alleging that the finding was contrary to the evidence, contrary to law, and that improper evidence had been admitted. The motion was denied.\nOn April 30, 1942 appellee, as plaintiff, filed a second suit against appellant in the Small Claims Branch of the Municipal Court for the District of Columbia for the sum of $35.72 “for annual sewer and water assessment for the years 1941 and 1942 which the defendant assumed to pay on the property” (describing said premises).\nUpon the hearing of this case the payment by appellee of two installments of the assessment amounting to $17.36 each was admitted. Each party relied upon the stenographic record and the judgment in Case No. 397,249. No additional evidence was offered. Appellee’s position was, and now is, that in the prior suit there had been an adjudication of his right to be reimbursed subsequent annual payments of the assessment. Appellant by his plea to the complaint claimed that the judgment in the former suit constituted an estoppel against a second action for breach of the contract, and on this defense he now relies. Appellant’s plea was denied by the trial court and judgment was entered for the amount claimed. From this judgment we allowed an appeal.\nIn the reporter’s transcript, it appears that defendant in the first action denied liability for any part of the charge for improvements upon various grounds. Also that he claimed that appellee had not been damaged beyond the $17.36 paid by him, as he might “move away tomorrow” or sell the property and not pay the $404.00 then due to redeem the amount (R. 42, 43).\nThe judgment record in Case No. 397,249 does not show the basis for the allowance of the sum of $17.36. The trial judge in the first action advised the judge presiding at the trial of the present case “that the finding in that case was limited to $17.36, only for the reason that the accrued assessments had amounted to that amount and no more, at the time of the findings in that case.”\nWe express no opinion as to the legal effect of this statement as we do not regard it as material to our decision.\nHere, as in Baker v. Smith & Gott-lieb, Inc., supra, appellee treated the disclaimer of liability and the failure to pay as a total breach and sued for the total damage sustained — the cost of removing the lien as of that date. This was held to be a valid cause of action by the U. S. Court of Appeals. In the case before it that court upheld the contention that the entire cost of the improvements was recoverable in a single action for damages for breach of the contract. We regard this decision as conclusive upon us of the fact that as plaintiff in Case No. 397,249 appellee was entitled to recover an amount sufficient to indemnify him for future installments of the assessment. That the trial court in appellee’s first action adopted a different view and misconstrued his measure of damage is immaterial. His remedy was by appeal from that judgment; not in the filing of a second suit.\nIn Walton v. Ruggles, 180 Mass. 24, 61 N.E. 267, the court through Mr. Chief Justice Holmes said: “The defendant’s contract was entire and was broken before the date of the writ. All the damages that the plaintiff ever is to recover he must recover now.”\nThe suit there was for breach of an agreement to pay an installment mortgage note on which plaintiff, vendor of the property, remained liable. The defense was that plaintiff, at the time of suit, had paid but one installment. The court held that the defendant had breached the contract by his failure to pay the one installment when it matured and that: “The fact that the plaintiff’s absolute obligation may not require to be discharged until a future day at most could entitle the defendant only to a discount for prepayment.”\nIn Kimberly Coal Co. v. Douglas, 6 Cir., 1930, 45 F.2d 25, 28, it was held: “that the trial court was of the opinion that recovery could not be had for future injury proximately caused by the breach, is without effect. The judgment on the merits rendered in the former action between the same parties and by reason of the same alleged breach of contract, operates as an estoppel not only as to every element which was in fact made the basis of the claim, but as to every other matter which might with propriety have been litigated and determined in that action.”\nIn McCargo v. Jergens, 206 N.Y. 363, 99 N.E. 838, 839, suit was brought for breach of a five year contract of employment. A deferred item of $2,000.00 was objected to “on the grounds that it was -not pleaded, and that it did not accrue until after the commencement of the action”. Although included in the original judgment it was eliminated by stipulation and the judgment modified accordingly. A second action was filed for its recovery and judgment given for the amount. In reversing this judgment the court said: “An action for wrongful discharge may include every element of damage arising from the discharge. It is an indivisible action, and one recovery is a bar to any further action for damages.”\nIn Overland Washington Motor Co. v. Alexander, 1915, .43 App.D.C. 282, defendant admitted owing one item of the claim. The court entered a judgment under former Rule 73 for that part and issue was joined on defendant’s pleas denying liability as to the part in dispute. On appeal it was held that the judgment was a bar to the further prosecution of the action.\nSee, also, Philadelphia, B. & W. R. Co. v. Karr, 38 App.D.C. 193; Poling v. Washington Loan & Trust Co., 53 App.D.C. 212, 289 F. 610; Olmstead v. Bach and Myers, 78 Md. 132, 27 A. 501, 22 L.R.A. 74, 44 Am. St.Rep. 273.\nThe effect of a judgment as an estoppel is summarized in United States v. Moser, 266 U.S. 236, 45 S.Ct. 66, 67, 69 L.Ed. 262, as follows: “The general principles [of res judicata] are well settled, and need not be discussed. The scope of their application depends upon whether the question arises in a subsequent action between'the same parties upon the same claim or demand or upon a different claim or demand. In the former case a judgment upon the merits constitutes an absolute bar to the subsequent action. In the latter case the inquiry is whether the point or question presented for determination in the subsequent action is the same as that litigated and determined in the original action.”\nThe present case falls within the first described class. The action is between the same parties, on the same cause of action. The prior judgment is conclusive and no inquiry may be made as to the particular point or question involved in the decision of that suit.\nThe judgment is therefore reversed and the case remanded with instructions to the trial court to set aside the former judgment and to enter judgment for the defendant.\nReversed.\nA close analogy exists between the rule followed in the present case and that applied by the Circuit Court of Appeals, 6th Circuit, in Federal Life Insurance Co. v. Rascoe, 12 F.2d 693, 696. There an insurer denied liability on a weekly payment indemnity contract on the ground that insured was not permanently and totally incapacitated. Suit was for a lump sum, including payments matured and future payments computed on mortality tables. In part, the court said: “This is a single contract. The fact that defendant is required to perform in part at stated intervals does not change its unitary character into a multiplicity of contracts, each relating to but one installment. If there has been an actual breach, coupled with repudiation, of this one contract, then, to avoid a multiplicity of suits, public policy requires that plaintiff may maintain but one action for the entire damages occasioned by such breach.”\nCertiorari was denied, 273 U.S. 722, 47 S.Ct. 112, 71 L.Ed. 859. This is apparently the only Federal Court decision on a question on which State Courts are sharply divided.\nSee, also, Roehm v. Horst, 178 U.S. 1, 20 S.Ct. 780, 44 L.Ed. 953; O’Neill v. Supreme Council, American Legion of Honor, 70 N.J.L. 410, 57 A. 463, 1 Ann. Cas. 422."", 'type': 'majority', 'author': 'RICHARDSON, Chief Judge.'}], 'attorneys': ['Samuel F. Beach, of Washington, D. C. (James W. Gill, of Washington, D. C., on the brief), for appellant.', 'N. Meyer Baker, of Washington, D. C., (John F. Lillard, of Hyattsville, Md., on the brief), for appellee.'], 'corrections': '', 'head_matter': 'SMITH & GOTTLIEB, Inc., v. CHEATHAM.\nNo. 6.\nMunicipal Court of Appeals for the District of Columbia.\nDec. 21, 1942.\nSamuel F. Beach, of Washington, D. C. (James W. Gill, of Washington, D. C., on the brief), for appellant.\nN. Meyer Baker, of Washington, D. C., (John F. Lillard, of Hyattsville, Md., on the brief), for appellee.\nBefore RICHARDSON, Chief Judge, HOOD, Associate Judge, and McMAHON, Judge of Municipal Court for District of Columbia.'}"
HERNDON v. HIGDON,Herndon v. Higdon,1943-01-13,No. 17,854,856,"[{'type': 'official', 'cite': '31 A.2d 854'}]","{'name_abbreviation': 'D.C.', 'id': 21806, 'name': 'District of Columbia Municipal Court of Appeals'}","{'id': 56, 'name_long': 'District of Columbia', 'name': 'D.C.'}","{'judges': ['■ Before RICHARDSON, Chief Judge, and CAYTON and HOOD, Associate Judges.'], 'parties': ['HERNDON v. HIGDON.'], 'opinions': [{'text': ""RICHARDSON, Chief Judge.\nParties will be designated as in the trial court.\nThe suit was for damages to plaintiff’s automobile resulting from a collision with defendant’s car at the intersection of 26th and I Streets, N.W., on June 15, 1942. Both were private passenger cars. The accident occurred at noon, the day was clear, the street dry. The only other traffic noted was a southbound truck on 26th Street, north of I Street. There were neither traffic signs nor signals at this corner.\nPlaintiff was driving north on 26th Street; defendant east on I Street. Plaintiff testified that he was driving about 25 miles per hour; that as he approached the intersection he took his foot off the accelerator but did not apply his brakes; that at the time of the impact his speed was 25 to 30 miles per hour.\nHe stated that when about to enter the-intersection he looked to the left and to' the right. He could see about two car-lengths to the left, did not see defendant’s, car, and had practically cleared the intersection when his car was struck on the-left rear.\nA passenger in his car, seated on plaintiff’s right, testified that when they were-about to enter the intersection he saw defendant’s car about two and one-half car lengths away, coming faster than plaintiff’s car was moving.\nDefendant testified that he approached the intersection at about 20 miles per hour. There was a southbound truck on 26th Street, north of I Street, whifch stopped and the driver waved him on. He saw plaintiff’s car when it was 20 feet from the intersection, applied his brakes and slid to the center of the intersection, the front of his car striking the left rear of plaintiff’s..\nThere were skid marks of defendant’s car on the pavement, 12 to IS feet long, commencing 3 feet within the intersection.\nThe trial court found that defendant was negligent, denied his defense of plaintiff’s contributory negligence, and entered judgment for plaintiff.\nUnquestionably the facts established defendant’s negligence. He was required on approaching the intersection, to look both to the left and to the right for on-coming traffic — particularly to his right as traffic from that direction had the right of way. He did look to his left, saw a truck stop, and saw the driver wave him on. He did not see plaintiff’s car until it was 20 feet from the intersection — where his own car was at that time he does not state. Until then he did not attempt to apply his brakes or slacken his speed. As he was presumably driving on the south side of I Street, that part which plaintiff’s car would first enter, a collision was then practically inevitable.\nContributory negligence to bar a recovery is a question of f'act, subject, however, to the application of certain definite legal principles depending upon the facts and circumstances of individual cases.\nHere it is claimed that plaintiff was negligent because he failed to see defendant’s approaching car, citing Faucett v. Bergmann, 57 App.D.C. 290, 22 F.2d 718. That was a pedestrian case. Where automobiles approach an intersection at 25 miles per hour — 37 feet per second — other factors enter.\nThere were cars parked on I Street within 10 or 15 feet of the intersection, which would partially obstruct plaintiff’s view of traffic approaching from that direction. He states he could see two car. lengths back of the intersection. He did not see defendant’s car.\nHaving the right of way over traffic approaching from the left in view of the then proximity of his car to the intersection, he proceeded without looking further. This alone would not constitute negligence in law. He could assume that any car then approaching the intersection would comply with the law.\nIt is also claimed-that the speed at which plaintiff entered and crossed the intersection was excessive and constituted contributory negligence.\nWhile we do not find, under the conditions here shown, that plaintiff’s car was in fact proceeding at an excessive speed, we think the question before the trial court was whether its speed, if excessive, was a contributing cause of the collision. One driving at an excessive or prohibited rate of speed is not barred from recovering unless that is shown to have been a contributing factor to the ensuing collision.\nIn Wallace v. Yellow Cab Co., 238 Ill. App. 283, where the facts were nearly identical with this case, the court said: “We think that the court was also justified in finding that the speed at which plaintiff’s car was running was not the proximate cause of the collision, and that it was caused by the negligent failure of defendant’s chauffeur to check the speed of the cab and allow plaintiff’s car to pass in front of it.”\nUnder the other conditions existing here, had the speed of plaintiff’s car been 20 miles per hour, or even less, the court might well have concluded that this would merely have varied the point of impact of the cars.\nWe are mindful that one having the right of way is not absolved of the duty of exercising reasonable care in entering an intersection. That one is entering in the favored direction must, however, be taken into consideration in determining whether he exercised reasonable care under the circumstances.\nWe find no error in the action of the trial court.\nAffirmed.\nGibbs v. Almstrom, 145 Minn. 35, 176 N.W. 173, 11 A.L.R. 227.\nJ. Maury Dove Co. v. Cook, 59 App.D. C. 61, 32 F.2d 957; Pearson v. Norell, 198 Minn. 303, 269 N.W. 643; Kunz v. Thorp Fire-Proof Door Co., 150 Minn. 362, 185 N.W. 376; Arvo v. Delta Hardware Co., 231 Mich. 488, 204 N.W. 134; Bramley v. Dilworth, 6 Cir., 274 F. 267; Vicker-son v. Standard Auto Sales Co., 64 Cal. App. 287, 221 P. 392; Paulsen v. Klinge, 92 N.J.L. 99, 104 A. 95; 42 C.J. 988.\nCoffin v. Laskau, 89 Conn. 325, 94 A. 370, L.R.A.1915E, 959; Marchese v. Metheny, 23 Ariz. 333, 203 P. 567; Godeau v. Levy, 72 Cal.App. 13, 236 P. 354; Spencer v. Phillips & Taylor, 219 Mich. 353, 189 N.W. 204.\nBland v. Hershey, 60 App.D.C. 226, 50 F.2d 991.\nCarlson v. Meusberger, 200 Iowa 65, 204 N.W. 432; McCaffrey v. Automobile Liability Co., Ltd, 176 Wis. 230, 186 N. W. 585; Glatz v. Kroeger Bros. Co., 168 Wis. 635, 170 N.W. 934."", 'type': 'majority', 'author': 'RICHARDSON, Chief Judge.'}], 'attorneys': ['Adelard L. Brault, of Washington, D. C. (Charles C. Collins, of Washington, D. C., on the brief), for appellant.', 'Vance V. Vaughan, of Washington, D. C, for appellee.'], 'corrections': '', 'head_matter': 'HERNDON v. HIGDON.\nNo. 17.\nMunicipal Court of Appeals for District of Columbia.\nJan. 13, 1943\nAdelard L. Brault, of Washington, D. C. (Charles C. Collins, of Washington, D. C., on the brief), for appellant.\nVance V. Vaughan, of Washington, D. C, for appellee.\n■ Before RICHARDSON, Chief Judge, and CAYTON and HOOD, Associate Judges.'}"
